{
  "generated_at": "2026-07-14T20:53:34.898811+00:00",
  "results": [
    {
      "criterion": "same seven-effect cycle; crash after registry commit before ledger; persistent pause before next effect",
      "duplicates": 0,
      "effects": [
        "local_issue_manifest",
        "local_preregistration",
        "local_design",
        "local_candidate_commit",
        "local_fixture_evaluation",
        "local_review_attestations",
        "local_pull_request_manifest"
      ],
      "limitations": [
        "Cancellation case is persistent pause before the next effect, not an active-work latency measurement."
      ],
      "raw": {
        "artifact_count": 9,
        "crash_returncode": 77,
        "ledger_records": 9,
        "pause_run_returncode": 1,
        "stop_preserved": true
      },
      "runner_version": "1.0.0",
      "semantic_digest": "670b7755050db7fcf9e3b60f7912e4b6a59a379877ba7269a85bf2918730008d",
      "status": "passed",
      "substrate": "dbos",
      "substrate_version": "2.26.0",
      "terminal_state": "LOCAL_CANDIDATE_READY",
      "timings_ms": {
        "crash_to_recovery": 5593,
        "total": 9318
      },
      "tool_versions": {
        "dbos": "2.26.0",
        "mios_controller": "0.1.0",
        "python": "3.12.13"
      }
    },
    {
      "criterion": "same seven-effect cycle; crash after durable candidate effect; persistent pause before next effect",
      "duplicates": 0,
      "effects": [
        "local_issue_manifest",
        "local_preregistration",
        "local_design",
        "local_candidate_commit",
        "local_fixture_evaluation",
        "local_review_attestations",
        "local_pull_request_manifest"
      ],
      "limitations": [
        "Custom control is a minimal SQLite comparison fixture, not the MiOS controller implementation.",
        "Cancellation case is persistent pause before the next effect, not an active-work latency measurement."
      ],
      "raw": {
        "crash_returncode": 77,
        "effect_rows": 7,
        "pause_run_returncode": 73,
        "recovery_returncode": 0
      },
      "runner_version": "1.0.0",
      "semantic_digest": "670b7755050db7fcf9e3b60f7912e4b6a59a379877ba7269a85bf2918730008d",
      "status": "passed",
      "substrate": "custom_durable_control",
      "substrate_version": "sqlite-3.50.4",
      "terminal_state": "LOCAL_CANDIDATE_READY",
      "timings_ms": {
        "crash_to_recovery": 154,
        "total": 233
      },
      "tool_versions": {
        "python": "3.12.13",
        "sqlite": "3.50.4"
      }
    },
    {
      "criterion": "Temporal is runnable only with a local Temporal CLI and an explicitly provisioned local development service; remote/cloud service use is forbidden in Phase 1A.",
      "duplicates": 0,
      "effects": [],
      "limitations": [
        "No Temporal performance, recovery, or cancellation claim is made."
      ],
      "raw": {
        "captured_error": "temporal CLI not found",
        "cli_path": null
      },
      "runner_version": "1.0.0",
      "semantic_digest": null,
      "status": "not_runnable",
      "substrate": "temporal",
      "substrate_version": null,
      "terminal_state": null,
      "timings_ms": {},
      "tool_versions": {
        "python": "3.12.13",
        "temporal_cli": "unavailable"
      }
    }
  ],
  "scenario_version": "phase1a-durable-cycle-v1",
  "schema_version": "1.0.0",
  "source": {
    "base_commit": "029f0fbed2e506abbed4b58325668ae9a2c49af9",
    "manifest_path": "evaluation/manifests/phase1a-source.json",
    "manifest_sha256": "0ba1e3eaae3fc886b16414c812cc438db7fc4824a83b4fb4220a69be50b2f17b",
    "source_tree_digest": "701e8ea294783b8d7e6e24d91b9d89737fc4c9b14771b35ce4a2e2cb17cdda74"
  }
}
